{
  "approved_utc": "2026-10-14T19:51:12Z",
  "approver": "Carlos Diego Mondrik",
  "authority": "owner_approval",
  "contract_digest": "bcc5439db9631d1ca74e92ddc65026a95dcf95ef245830745b5a235f63e76c4a",
  "decision_ref": "docs/propuesta.md@2026-10-14",
  "id": "01M4XZG1MW65VRXZ8QF4ZA2JV7",
  "schema_version": "1",
  "work_item": "01M4XXZ7SMNQ36R65M2W9R4BFY"
}
