{
  "approved_utc": "2026-10-15T00:12:28Z",
  "approver": "Carlos Diego Mondrik",
  "authority": "owner_approval",
  "contract_digest": "2a385ae05493ef36d4bed195c227ca2f676db1687d2c5db940dd50af51c52956",
  "decision_ref": "sesion-156:Q1-Q3@2026-10-14",
  "id": "01M4YEEDW82WDNNJ3RRDTMQD6G",
  "schema_version": "1",
  "work_item": "01M4YAPE3S7VEMNJ4NA7GP75D2"
}
