{
  "approved_utc": "2026-10-14T04:12:35Z",
  "approver": "Carlos Diego Mondrik",
  "authority": "owner_approval",
  "contract_digest": "02e0c944715bafb294ec961e1ccc9b04bd05f04e401f8bcc2a1e68aabc2e2bad",
  "decision_ref": "docs/propuesta.md@2026-10-14",
  "id": "01M4W9SCN7H4YVTNM1HXXDZ4QC",
  "schema_version": "1",
  "work_item": "01M4W99TH56ZD9PFAVDQ6YC4SQ"
}
