{
  "approved_utc": "2026-10-14T13:48:14Z",
  "approver": "Carlos Diego Mondrik",
  "authority": "owner_approval",
  "contract_digest": "0f2b3941053dc115d20989332ba10913fe04c4c3dab53db261fb1e4ca23289c6",
  "decision_ref": "docs/propuesta.md@2026-10-14",
  "id": "01M4XAQE81DWHBVED6VMPW1RBH",
  "schema_version": "1",
  "work_item": "01M4X9H8GYCQ2KM5TQEJPZYGKZ"
}
